<?xml version="1.0" encoding="ISO-8859-1"?>
<!DOCTYPE cm_data PUBLIC '-//Gatespace//DTD cm_data 0.1//EN' 'cm_data.dtd'>
<cm_data version="0.1">
  <configuration pid="org.knopflerfish.fileinstall" mode="new">
    <property name="org.knopflerfish.fileinstall.dir">
      <vector length="1">
	<value type="String">./load</value>
      </vector>
    </property>
    <property name="service.pid">
      <value type="String">org.knopflerfish.fileinstall</value>
    </property>
    <property name="org.knopflerfish.fileinstall.uninstallOnStop">
      <value type="Boolean">true</value>
    </property>
    <property name="org.knopflerfish.fileinstall.poll">
      <value type="Long">1000</value>
    </property>
    <property name="org.knopflerfish.fileinstall.use.initial.startlevel">
      <value type="Boolean">false</value>
    </property>
    <property name="org.knopflerfish.fileinstall.startlevel">
      <value type="Integer">8</value>
    </property>
  </configuration>
</cm_data>
